Company,Description
Company A,Company A is engaged in the manufacturing of consumer electronics and operates worldwide.
Company B,Company B is a leading provider of financial services and operates primarily in the United States.
Company C,Company C is involved in the development of renewable energy projects across various countries.
Company D,"Company D specializes in pharmaceuticals and healthcare products, serving global markets."
Company E,Company E focuses on the production and distribution of food and beverages globally.
Company F,"Company F is a major player in the automotive industry, designing and manufacturing vehicles."
Company G,"Company G operates in the technology sector, providing software and hardware solutions."
Company H,"Company H is a global leader in the telecommunications industry, offering various communication services."
Company I,"Company I engages in the mining and extraction of natural resources, including metals and minerals."
Company J,"Company J is an established name in the retail industry, with numerous stores worldwide."
Company K,"Company K offers logistics and transportation services, facilitating global trade."
Company L,"Company L is known for its extensive portfolio in the real estate sector, managing commercial properties."
Company M,"Company M provides healthcare services, including hospitals and medical practices."
Company N,"Company N is a significant player in the fashion industry, designing and selling clothing and accessories."
Company O,"Company O operates in the media and entertainment industry, producing and distributing content."
